{
  "$schema": "https://json-schema.org/draft/2020-12/schema",
  "$id": "https://war-reporter.invalid/schemas/task-manifest.schema.json",
  "title": "Task manifest",
  "type": "object",
  "additionalProperties": false,
  "required": ["task_id", "task_type", "state", "window", "scope", "exclusions", "allowed_output_paths", "definition_of_done", "idempotency_key"],
  "properties": {
    "task_id": {"type": "string", "pattern": "^task_[a-z0-9][a-z0-9_-]*$"},
    "task_type": {
      "enum": ["campaign", "source_scan", "open_web_discovery", "extract_observations", "investigate_claim", "source_profile_review", "map_update", "daily_report", "weekly_report", "snapshot_report", "translate_report", "correction", "validation"]
    },
    "role": {"type": "string", "pattern": "^[a-z][a-z0-9-]*$"},
    "state": {"enum": ["planned", "ready", "leased", "collecting", "pr_open", "validating", "review", "merged", "blocked", "lease_expired", "rejected", "cancelled", "duplicate"]},
    "priority": {"type": "integer", "minimum": 0, "maximum": 100, "default": 50},
    "created_at": {"type": "string", "format": "date-time"},
    "parent_issue": {"type": ["integer", "null"], "minimum": 1},
    "issue_number": {"type": ["integer", "null"], "minimum": 1},
    "depends_on_task_ids": {"type": "array", "items": {"type": "string", "pattern": "^task_[a-z0-9][a-z0-9_-]*$"}, "uniqueItems": true, "default": []},
    "window": {
      "type": "object",
      "additionalProperties": false,
      "required": ["from", "to"],
      "properties": {
        "from": {"type": "string", "format": "date-time"},
        "to": {"type": "string", "format": "date-time"}
      }
    },
    "scope": {
      "type": "object",
      "additionalProperties": false,
      "required": ["source_ids", "regions", "topics", "content_types"],
      "properties": {
        "source_ids": {"type": "array", "items": {"type": "string", "pattern": "^src_[a-z0-9][a-z0-9_-]*$"}, "uniqueItems": true},
        "source_item_ids": {"type": "array", "items": {"type": "string", "pattern": "^item_[a-z0-9][a-z0-9_-]*$"}, "uniqueItems": true, "default": []},
        "source_groups": {"type": "array", "items": {"type": "string", "minLength": 1}, "uniqueItems": true, "default": []},
        "regions": {"type": "array", "items": {"type": "string", "minLength": 1}, "uniqueItems": true},
        "topics": {"type": "array", "items": {"type": "string", "minLength": 1}, "uniqueItems": true},
        "content_types": {"type": "array", "items": {"type": "string", "minLength": 1}, "uniqueItems": true}
      }
    },
    "report_inputs": {
      "type": "object",
      "additionalProperties": false,
      "required": ["claim_ids", "assessment_ids", "claim_set_sha256"],
      "properties": {
        "claim_ids": {
          "type": "array",
          "items": {"type": "string", "pattern": "^clm_[a-z0-9][a-z0-9_-]*$"},
          "uniqueItems": true
        },
        "assessment_ids": {
          "type": "array",
          "items": {"type": "string", "pattern": "^asm_[a-z0-9][a-z0-9_-]*$"},
          "uniqueItems": true
        },
        "claim_set_sha256": {"type": "string", "pattern": "^[a-f0-9]{64}$"}
      },
      "anyOf": [
        {"properties": {"claim_ids": {"minItems": 1}}},
        {"properties": {"assessment_ids": {"minItems": 1}}}
      ]
    },
    "exclusions": {"type": "array", "items": {"type": "string", "minLength": 1}, "uniqueItems": true},
    "allowed_output_paths": {"type": "array", "minItems": 1, "items": {"type": "string", "pattern": "^(?!/)(?!.*(?:^|/)\\.\\.(?:/|$)).+"}, "uniqueItems": true},
    "definition_of_done": {"type": "array", "minItems": 1, "items": {"type": "string", "minLength": 1}, "uniqueItems": true},
    "idempotency_key": {"type": "string", "minLength": 8},
    "lease": {
      "type": ["object", "null"],
      "additionalProperties": false,
      "required": ["worker_run_id", "lease_branch", "base_sha", "leased_at", "lease_until"],
      "properties": {
        "worker_run_id": {"type": "string", "pattern": "^run_[a-zA-Z0-9_-]+$"},
        "lease_branch": {"type": "string", "pattern": "^work/task_[a-z0-9][a-z0-9_-]*$"},
        "base_sha": {"type": "string", "pattern": "^[a-f0-9]{40}$"},
        "leased_at": {"type": "string", "format": "date-time"},
        "lease_until": {"type": "string", "format": "date-time"}
      }
    },
    "blocked_reason": {"type": "string", "minLength": 1},
    "result": {
      "type": "object",
      "additionalProperties": false,
      "required": ["branch", "pr_number"],
      "properties": {
        "branch": {"type": "string", "pattern": "^work/task_[a-z0-9][a-z0-9_-]*$"},
        "pr_number": {"type": "integer", "minimum": 1},
        "completed_at": {"type": ["string", "null"], "format": "date-time"},
        "merge_sha": {"type": "string", "pattern": "^[a-f0-9]{40}$"},
        "merged_at": {"type": "string", "format": "date-time"},
        "summary": {"type": "string", "minLength": 1},
        "coverage_gaps": {"type": "array", "items": {"type": "string", "minLength": 1}, "uniqueItems": true}
      }
    }
  },
  "allOf": [
    {
      "if": {"properties": {"state": {"enum": ["leased", "collecting", "pr_open", "validating", "review"]}}, "required": ["state"]},
      "then": {"required": ["lease"], "properties": {"lease": {"type": "object"}}}
    },
    {
      "if": {"properties": {"state": {"enum": ["planned", "ready", "merged", "blocked", "lease_expired", "rejected", "cancelled", "duplicate"]}}, "required": ["state"]},
      "then": {"properties": {"lease": {"type": "null"}}}
    },
    {
      "if": {"properties": {"state": {"enum": ["pr_open", "validating", "review", "merged"]}}, "required": ["state"]},
      "then": {"required": ["result"]}
    },
    {
      "if": {"properties": {"state": {"const": "merged"}}, "required": ["state"]},
      "then": {"properties": {"result": {"required": ["branch", "pr_number", "merge_sha", "merged_at"]}}}
    },
    {
      "if": {"properties": {"state": {"const": "blocked"}}, "required": ["state"]},
      "then": {"required": ["blocked_reason"]}
    },
    {
      "if": {"properties": {"task_type": {"const": "daily_report"}}, "required": ["task_type"]},
      "then": {"required": ["report_inputs"]}
    }
  ]
}
