{
  "task_id": "task_auto_fa8bc1c2447a3555",
  "task_type": "investigate_claim",
  "role": "corroborator",
  "state": "leased",
  "priority": 75,
  "created_at": "2026-08-06T07:35:05.919111Z",
  "parent_issue": null,
  "issue_number": null,
  "depends_on_task_ids": [
    "task_daily_20260805_80_report_inputs"
  ],
  "window": {
    "from": "2026-08-05T00:00:00Z",
    "to": "2026-08-06T00:00:00Z"
  },
  "scope": {
    "content_types": [
      "claim",
      "assessment"
    ],
    "regions": [
      "ukraine-war"
    ],
    "source_ids": [
      "src_the_guardian"
    ],
    "source_item_ids": [
      "item_20260805_guardian_air_defence_criticism"
    ],
    "topics": [
      "zelenskyy-primary-statement-verification",
      "air-defence-support",
      "sanctions"
    ],
    "source_groups": []
  },
  "exclusions": [
    "Do not infer a primary presidential statement solely from secondary repetition",
    "Do not convert the edited article into an immutable artifact retroactively",
    "Do not approve underlying statement claims until primary evidence or independent compatible corroboration is frozen"
  ],
  "allowed_output_paths": [
    "data/claims/2026/08/05/zelenskyy-support-request-verification.ndjson",
    "data/assessments/2026/08/05/zelenskyy-support-request-verification.ndjson",
    "queue/proposals/task_auto_fa8bc1c2447a3555.json",
    "review/self/task_auto_fa8bc1c2447a3555.json"
  ],
  "definition_of_done": [
    "A primary presidential post or transcript is frozen with publication metadata, or the inability to retrieve it is documented",
    "The three object-level statement claims are reassessed separately from the Guardian attribution events",
    "Any unresolved object-level statement remains unapproved",
    "Two separate self-review rounds pass",
    "Two separate self-review rounds passed and a receipt was persisted"
  ],
  "idempotency_key": "claim_corroboration:2026-08-05:zelenskyy-support-requests",
  "lease": {
    "worker_run_id": "run_20260806T080430Z_zelenskyy_primary_verification",
    "lease_branch": "work/task_auto_fa8bc1c2447a3555",
    "base_sha": "a71d319615185042578379c2bfc05e115c4eb7f6",
    "leased_at": "2026-08-06T08:04:30Z",
    "lease_until": "2026-08-06T09:04:30Z"
  }
}
