{
  "task_id": "task_20260804_10_reactions_corrections",
  "task_type": "open_web_discovery",
  "role": "open-web-discovery",
  "state": "pr_open",
  "priority": 70,
  "created_at": "2026-08-04T18:28:29Z",
  "parent_issue": 5,
  "issue_number": 24,
  "depends_on_task_ids": [],
  "window": {
    "from": "2026-08-03T18:00:00Z",
    "to": "2026-08-04T18:00:00Z"
  },
  "scope": {
    "source_ids": [],
    "source_groups": [],
    "regions": [
      "ukraine-war"
    ],
    "topics": [
      "reactions",
      "criticism",
      "corrections",
      "retractions"
    ],
    "content_types": [
      "post",
      "article",
      "report",
      "briefing",
      "document",
      "image",
      "video",
      "map"
    ]
  },
  "exclusions": [
    "Items already represented by canonical URL, platform ID, or content hash",
    "Access-control bypass, private material, and unsafe non-public geodata",
    "Precise current operational positions or targeting-enabling detail"
  ],
  "allowed_output_paths": [
    "catalogs/sources/2026/08/04/reactions-corrections.json",
    "data/source-items/2026/08/04/reactions-corrections.ndjson",
    "data/artifacts/2026/08/04/reactions-corrections.ndjson",
    "raw-manifests/2026/08/04/reactions-corrections.json"
  ],
  "definition_of_done": [
    "The assigned public-web discovery shard and UTC window were searched",
    "Primary publications, corrections, and retractions were preferred and upstream lineage was recorded",
    "Canonical URLs, timestamps, language, quote locators, and access failures were recorded",
    "Candidate source profiles and follow-up task proposals were persisted when justified",
    "No final truth assessment, territorial conclusion, or report narrative was added"
  ],
  "idempotency_key": "open_web_discovery:reactions-corrections:20260803T1800Z:20260804T1800Z:ukraine-war",
  "lease": {
    "worker_run_id": "run_20260805T044202Z_b31d94e7",
    "lease_branch": "work/task_20260804_10_reactions_corrections",
    "base_sha": "7d8f3e13261f24e121ec4f8b63c6d200df4e2eb1",
    "leased_at": "2026-08-05T04:42:22Z",
    "lease_until": "2026-08-05T06:42:22Z"
  },
  "result": {
    "branch": "work/task_20260804_10_reactions_corrections",
    "pr_number": 26,
    "completed_at": "2026-08-05T04:48:24Z",
    "summary": "Bounded public-web discovery registered three draft source profiles and four source items covering attributable reactions and criticism. Search provenance, upstream candidates, an out-of-window clarification, access failures, and follow-up proposals are recorded; no artifacts or truth assessments were added.",
    "coverage_gaps": [
      "No clearly dated primary formal correction or retraction notice was found in the exact task window on the queried fact-check and corrections pages.",
      "Direct official URLs for the August 4 Turkish Foreign Ministry statement and cited Ukrainian platform posts were not resolved.",
      "Platform-native Telegram and X items were not directly collected where stable public canonical URLs and precise metadata could not be verified.",
      "The scan was bounded and is not exhaustive across all outlets, languages, or platforms."
    ]
  }
}
