{
  "task_id": "task_backfill_20260804_extract_official",
  "task_type": "extract_observations",
  "role": "extractor",
  "state": "ready",
  "priority": 90,
  "created_at": "2026-08-05T17:22:00Z",
  "parent_issue": 81,
  "issue_number": null,
  "depends_on_task_ids": [],
  "window": {
    "from": "2026-08-04T00:00:00Z",
    "to": "2026-08-05T00:00:00Z"
  },
  "scope": {
    "source_ids": [],
    "source_item_ids": [
      "item_20260804_mod_66255",
      "item_20260804_mod_66256",
      "item_20260804_mod_66263",
      "item_20260804_mod_66266",
      "item_20260804_mod_66268",
      "item_20260804_mod_66271",
      "item_20260804_generalstaff_0800",
      "item_20260804_generalstaff_air_defense",
      "item_20260804_generalstaff_strikes"
    ],
    "source_groups": [],
    "regions": ["ukraine-war"],
    "topics": ["backfill", "official-statements", "operations", "strikes"],
    "content_types": ["post"]
  },
  "exclusions": [
    "Any source item outside the frozen UTC window",
    "External web research or introduction of evidence not already stored in the repository",
    "Final truth assessment, source reliability scoring, report narrative, or targeting-enabling detail",
    "Treating Russian MoD summary item_20260804_mod_66271 as independent from its recorded upstream items"
  ],
  "allowed_output_paths": [
    "data/observations/2026/08/04/backfill-official.ndjson",
    "queue/proposals/task_backfill_20260804_extract_official.json",
    "review/self/task_backfill_20260804_extract_official.json"
  ],
  "definition_of_done": [
    "Every assigned source item was reviewed against its stored source-item record and raw manifest",
    "Each material attributable assertion was represented as an atomic draft observation, or the omission reason was recorded as a coverage gap",
    "Attribution, modality, publication-time precision, revision or upstream lineage, excerpts, and locators were preserved",
    "No observation was promoted beyond draft and no claim or assessment was created",
    "A queue proposal receipt was persisted; an empty proposals array is acceptable because the downstream graph is pre-materialized",
    "Two separate self-review rounds passed and a receipt was persisted"
  ],
  "idempotency_key": "backfill_extract:2026-08-04:official:ukraine-war:v1",
  "lease": null
}
