{
  "task_id": "task_auto_1d3a947706bff4ee",
  "task_type": "extract_observations",
  "role": "extractor",
  "state": "ready",
  "priority": 60,
  "created_at": "2026-08-05T11:06:25.178473Z",
  "parent_issue": 33,
  "issue_number": null,
  "depends_on_task_ids": [
    "task_20260805_07_strikes_infrastructure"
  ],
  "window": {
    "from": "2026-08-04T18:00:00Z",
    "to": "2026-08-05T05:00:00Z"
  },
  "scope": {
    "source_ids": [
      "src_vitaliy_klitschko"
    ],
    "source_groups": [],
    "regions": [
      "ukraine-war"
    ],
    "topics": [
      "strikes",
      "infrastructure",
      "casualties"
    ],
    "content_types": [
      "post"
    ]
  },
  "exclusions": [
    "Do not convert attributed statements into verified facts",
    "Do not retain precise sensitive-site detail or current operational movement information",
    "Do not treat updates in the same incident lineage as independent corroboration",
    "Do not process any source item other than item_20260805_klitschko_attack_consolidated and item_20260805_klitschko_casualty_update"
  ],
  "allowed_output_paths": [
    "data/observations/2026/08/05/strikes-infrastructure.ndjson",
    "queue/proposals/task_auto_1d3a947706bff4ee.json",
    "review/self/task_auto_1d3a947706bff4ee.json"
  ],
  "definition_of_done": [
    "Atomic attributed observations are linked to the accepted source items",
    "Qualifiers, revision lineage, temporal precision, and safety generalization are preserved",
    "No claim assessment or report narrative is added",
    "Only item_20260805_klitschko_attack_consolidated and item_20260805_klitschko_casualty_update are processed",
    "Two separate self-review rounds passed and a receipt was persisted"
  ],
  "idempotency_key": "extract_observations:strikes-infrastructure:20260804T1800Z:20260805T0500Z",
  "lease": null
}
