{
  "task_id": "task_20260804_08_visual_osint_maps",
  "task_type": "open_web_discovery",
  "role": "open-web-discovery",
  "state": "leased",
  "priority": 75,
  "created_at": "2026-08-04T18:28:29Z",
  "parent_issue": 5,
  "issue_number": 20,
  "depends_on_task_ids": [],
  "window": {
    "from": "2026-08-03T18:00:00Z",
    "to": "2026-08-04T18:00:00Z"
  },
  "scope": {
    "source_ids": [],
    "source_groups": [],
    "regions": ["ukraine-war"],
    "topics": ["visual-osint", "geolocation", "maps"],
    "content_types": ["post", "article", "report", "briefing", "document", "image", "video", "map"]
  },
  "exclusions": [
    "Items already represented by canonical URL, platform ID, or content hash",
    "Access-control bypass, private material, and unsafe non-public geodata",
    "Precise current operational positions or targeting-enabling detail"
  ],
  "allowed_output_paths": [
    "catalogs/sources/2026/08/04/visual-osint-maps.json",
    "data/source-items/2026/08/04/visual-osint-maps.ndjson",
    "data/artifacts/2026/08/04/visual-osint-maps.ndjson",
    "raw-manifests/2026/08/04/visual-osint-maps.json"
  ],
  "definition_of_done": [
    "The assigned public-web discovery shard and UTC window were searched",
    "Primary publications were preferred and upstream lineage was recorded",
    "Canonical URLs, timestamps, language, quote locators, and access failures were recorded",
    "Candidate source profiles and follow-up task proposals were persisted when justified",
    "No precise active positions, final territorial conclusion, or report narrative was added"
  ],
  "idempotency_key": "open_web_discovery:visual-osint-maps:20260803T1800Z:20260804T1800Z:ukraine-war",
  "lease": {
    "worker_run_id": "run_20260805T044134Z_8c2f9a10",
    "lease_branch": "work/task_20260804_08_visual_osint_maps",
    "base_sha": "7d8f3e13261f24e121ec4f8b63c6d200df4e2eb1",
    "leased_at": "2026-08-05T04:41:34Z",
    "lease_until": "2026-08-05T06:41:34Z"
  }
}
