{
  "allowed_output_paths": [
    "catalogs/sources/2026/08/04/ru-official.json",
    "data/source-items/2026/08/04/ru-official.ndjson",
    "data/artifacts/2026/08/04/ru-official.ndjson",
    "raw-manifests/2026/08/04/ru-official.json"
  ],
  "created_at": "2026-08-04T18:28:29Z",
  "definition_of_done": [
    "The assigned public-web discovery shard and UTC window were searched",
    "Primary publications were preferred and upstream lineage was recorded",
    "Canonical URLs, timestamps, language, quote locators, and access failures were recorded",
    "Candidate source profiles and follow-up task proposals were persisted when justified",
    "No final truth assessment, territorial conclusion, or report narrative was added"
  ],
  "depends_on_task_ids": [],
  "exclusions": [
    "Items already represented by canonical URL, platform ID, or content hash",
    "Access-control bypass, private material, and unsafe non-public geodata",
    "Precise current operational positions or targeting-enabling detail"
  ],
  "idempotency_key": "open_web_discovery:ru-official:20260803T1800Z:20260804T1800Z:ukraine-war",
  "issue_number": 9,
  "lease": null,
  "parent_issue": 5,
  "priority": 90,
  "result": {
    "branch": "work/task_20260804_02_ru_official",
    "completed_at": "2026-08-05T05:00:19Z",
    "coverage_gaps": [
      "Telegram public previews expose only a recent window and may not preserve later edits or deletions.",
      "No immutable page captures were stored; source-item content hashes and artifact manifests therefore remain absent.",
      "MAX and VK mirrors were not collected because the public-web search did not provide equally stable, directly inspectable post pages.",
      "This is a bounded discovery pass, not an exhaustive survey of every Russian federal or regional official account."
    ],
    "merge_sha": "125bde9ef75f17def6458c16b43bbae0617d26c1",
    "merged_at": "2026-08-05T05:00:19Z",
    "pr_number": 12,
    "summary": "Recorded three draft candidate profiles for Russian official sources and six in-window Russian Ministry of Defence Telegram source items, including explicit upstream lineage for the daily summary. No truth assessment or immutable artifact capture was added."
  },
  "role": "open-web-discovery",
  "scope": {
    "content_types": [
      "post",
      "article",
      "report",
      "briefing",
      "document",
      "image",
      "video",
      "map"
    ],
    "regions": [
      "ukraine-war"
    ],
    "source_groups": [],
    "source_ids": [],
    "topics": [
      "russian-official-statements",
      "frontline",
      "strikes"
    ]
  },
  "state": "merged",
  "task_id": "task_20260804_02_ru_official",
  "task_type": "open_web_discovery",
  "window": {
    "from": "2026-08-03T18:00:00Z",
    "to": "2026-08-04T18:00:00Z"
  }
}
