{
  "task_id": "task_20260805_07_strikes_infrastructure",
  "task_type": "open_web_discovery",
  "role": "open-web-discovery",
  "state": "merged",
  "priority": 80,
  "created_at": "2026-08-05T05:06:14Z",
  "parent_issue": 33,
  "issue_number": 48,
  "depends_on_task_ids": [],
  "window": {
    "from": "2026-08-04T18:00:00Z",
    "to": "2026-08-05T05:00:00Z"
  },
  "scope": {
    "source_ids": [],
    "source_groups": [],
    "regions": [
      "ukraine-war"
    ],
    "topics": [
      "strikes",
      "air-defense",
      "infrastructure"
    ],
    "content_types": [
      "post",
      "article",
      "report",
      "briefing",
      "document",
      "image",
      "video",
      "map"
    ]
  },
  "exclusions": [
    "Items already represented by canonical URL, platform ID, or content hash",
    "Access-control bypass, private material, and unsafe non-public geodata",
    "Precise current operational positions or targeting-enabling detail"
  ],
  "allowed_output_paths": [
    "catalogs/sources/2026/08/05/strikes-infrastructure.json",
    "data/source-items/2026/08/05/strikes-infrastructure.ndjson",
    "data/artifacts/2026/08/05/strikes-infrastructure.ndjson",
    "raw-manifests/2026/08/05/strikes-infrastructure.json"
  ],
  "definition_of_done": [
    "The assigned public-web discovery shard and UTC window were searched",
    "Primary publications were preferred and upstream lineage was recorded",
    "Canonical URLs, timestamps, language, quote locators, and access failures were recorded",
    "Candidate source profiles and follow-up task proposals were persisted when justified",
    "No final truth assessment, territorial conclusion, or report narrative was added"
  ],
  "idempotency_key": "open_web_discovery:strikes-infrastructure:20260804T1800Z:20260805T0500Z:ukraine-war",
  "lease": null,
  "result": {
    "branch": "work/task_20260805_07_strikes_infrastructure",
    "pr_number": 49,
    "completed_at": "2026-08-05T10:55:46Z",
    "merge_sha": "67aee1b0942c353db39a7fbbb8a47a1555c4c902",
    "merged_at": "2026-08-05T10:55:46Z",
    "summary": "Registered a draft profile for the official Vitali Klitschko Telegram account and two unique in-window primary updates on the overnight Kyiv attack. Existing Reuters and DSNS publications were excluded as duplicates, live target-direction warnings were excluded for safety, no binaries were captured, and two downstream task proposals were persisted.",
    "coverage_gaps": [
      "Only two unique upstream official posts were retained after global deduplication within the narrow eleven-hour window.",
      "Public Telegram context pages provided stable post IDs and displayed local times but no immutable captures or content hashes.",
      "Same-day official website and infrastructure-operator indexing lagged the event, so no distinct DTEK, Ukrenergo, ministry, or municipal-operator publication with a verified in-window timestamp was retained.",
      "Live air-defense warnings and movement-direction notices were intentionally excluded for operational safety.",
      "No image, video, map, full-text, or other binary artifact was downloaded or hashed."
    ]
  }
}
