{
  "task_id": "task_auto_12ce9e2a1b9f4926",
  "task_type": "extract_observations",
  "role": "extractor",
  "state": "review",
  "priority": 55,
  "created_at": "2026-08-05T12:17:54.289043Z",
  "parent_issue": 33,
  "issue_number": 77,
  "depends_on_task_ids": [
    "task_20260805_10_reactions_corrections"
  ],
  "window": {
    "from": "2026-08-04T18:00:00Z",
    "to": "2026-08-05T05:00:00Z"
  },
  "scope": {
    "source_ids": [
      "src_the_guardian"
    ],
    "source_item_ids": [
      "item_20260805_guardian_air_defence_criticism"
    ],
    "source_groups": [],
    "regions": [
      "ukraine-war"
    ],
    "topics": [
      "reactions",
      "criticism",
      "air-defense-support",
      "sanctions"
    ],
    "content_types": [
      "article"
    ]
  },
  "exclusions": [
    "Do not convert attributed statements, casualty figures or interception figures into verified facts",
    "Do not treat publications sharing the overnight Kyiv attack lineage as independent corroboration",
    "Do not retain precise sensitive-site or targeting-enabling detail"
  ],
  "allowed_output_paths": [
    "data/observations/2026/08/05/reactions-corrections.ndjson",
    "queue/proposals/task_auto_12ce9e2a1b9f4926.json",
    "review/self/task_auto_12ce9e2a1b9f4926.json"
  ],
  "definition_of_done": [
    "Atomic attributable observations are linked to the accepted source item",
    "Criticism, requested support, sanctions language, qualifiers and common upstream lineage are preserved",
    "No claim assessment, reliability judgment or report narrative is added",
    "Two separate self-review rounds passed and a receipt was persisted"
  ],
  "idempotency_key": "extract_observations:reactions-corrections:20260804T1800Z:20260805T0500Z",
  "lease": {
    "worker_run_id": "run_20260805T123502Z_12ce9e2a",
    "lease_branch": "work/task_auto_12ce9e2a1b9f4926",
    "base_sha": "e5b1cb261ad604ea31582d0ba26a8711ebf19b81",
    "leased_at": "2026-08-05T12:35:02Z",
    "lease_until": "2026-08-05T14:35:02Z"
  },
  "result": {
    "branch": "work/task_auto_12ce9e2a1b9f4926",
    "pr_number": 78,
    "completed_at": "2026-08-05T12:37:35Z",
    "summary": "Extracted three draft atomic reaction observations from the frozen Guardian source item: attributed criticism of delayed air-defence deliveries, a request for additional air-defence support, and a request for additional sanctions. Guardian attribution, later-edit uncertainty, and shared Kyiv-attack lineage were preserved; no underlying statement or strike effect was independently verified.",
    "coverage_gaps": [
      "The accepted Guardian page was retrieved after a later edit, and the exact first-published article text was not captured.",
      "The underlying Zelenskyy social-media post was not separately registered with a stable primary canonical URL.",
      "The observations rely on the source-item title and short verification note preserved in the discovery manifest rather than a copied article body.",
      "The observations do not independently verify delayed deliveries, casualty figures, interception figures, damage, weapon type, targeting intent, or strike attribution."
    ]
  }
}
