{
  "task_id": "task_backfill_20260805_03_ua_analysis_media",
  "task_type": "open_web_discovery",
  "role": "open-web-discovery",
  "state": "review",
  "priority": 85,
  "created_at": "2026-08-06T05:02:00Z",
  "parent_issue": 33,
  "issue_number": null,
  "depends_on_task_ids": [],
  "window": {
    "from": "2026-08-05T05:00:00Z",
    "to": "2026-08-06T00:00:00Z"
  },
  "scope": {
    "source_ids": [],
    "source_groups": [],
    "regions": [
      "ukraine-war"
    ],
    "topics": [
      "ukrainian-analysis",
      "ukrainian-media",
      "operations"
    ],
    "content_types": [
      "post",
      "article",
      "report",
      "briefing",
      "document",
      "image",
      "video",
      "map"
    ]
  },
  "exclusions": [
    "Items already represented by canonical URL, platform ID, or content hash",
    "Items already collected for 2026-08-05T00:00:00Z through 2026-08-05T05:00:00Z",
    "Access-control bypass, private material, and unsafe non-public geodata",
    "Precise current operational positions or targeting-enabling detail"
  ],
  "allowed_output_paths": [
    "catalogs/sources/2026/08/05/ua-analysis-media-backfill-0500-2400.json",
    "data/source-items/2026/08/05/ua-analysis-media-backfill-0500-2400.ndjson",
    "data/artifacts/2026/08/05/ua-analysis-media-backfill-0500-2400.ndjson",
    "raw-manifests/2026/08/05/ua-analysis-media-backfill-0500-2400.json"
  ],
  "definition_of_done": [
    "The assigned public-web discovery shard was searched for the missing 05:00–24:00 UTC interval on 5 August 2026",
    "Primary publications were preferred and upstream lineage was recorded",
    "Canonical URLs, timestamps, language, quote locators, and access failures were recorded",
    "Candidate source profiles and follow-up task proposals were persisted when justified",
    "No item from the already completed 00:00–05:00 UTC interval was duplicated",
    "No final truth assessment, territorial conclusion, or report narrative was added"
  ],
  "idempotency_key": "daily_discovery_gap:2026-08-05:ua-analysis-media:ukraine-war:20260805T0500Z:20260806T0000Z",
  "lease": {
    "worker_run_id": "run_20260806T055300Z_uaam03",
    "lease_branch": "work/task_backfill_20260805_03_ua_analysis_media",
    "base_sha": "c55abfc59972a385c537d8677963fc08f6ffb2fd",
    "leased_at": "2026-08-06T05:53:00Z",
    "lease_until": "2026-08-06T07:53:00Z"
  },
  "result": {
    "branch": "work/task_backfill_20260805_03_ua_analysis_media",
    "pr_number": 118,
    "completed_at": "2026-08-06T05:59:00Z",
    "summary": "Completed a bounded public-web recovery scan of Ukrainian media and analysis surfaces for the missing 05:00–24:00 UTC interval. No new source item was admitted because exact-date publisher archives and search indexes did not resolve a stable qualifying article page, while visible candidates were historical date collisions or already registered rolling-page and digest lineage. The raw manifest records Suspilne, Ukrainska Pravda, LB.ua, and Hromadske surfaces, exact-date queries, duplicates, archive failures, and safety boundaries. No article identifier or revision timestamp was inferred, no artifact was captured, and no truth assessment or report narrative was created.",
    "coverage_gaps": [
      "The zero-item result is not evidence that Ukrainian media published no relevant material during the interval.",
      "Search indexes and parsed archives may lag live publisher systems, omit pages, or expose rolling pages without stable revision timestamps.",
      "Previously registered live and digest pages may contain later updates, but those updates were not duplicated as independent publications without a stable version boundary.",
      "Direct broadcast, unit, social-media, and official upstream statements were outside this media recovery shard and were not exhaustively re-collected.",
      "No maps, images, video, full-text articles, or other binaries were downloaded or hashed.",
      "No media statement was independently assessed or converted into a claim, observation, territorial conclusion, or report narrative."
    ]
  }
}
