{
  "task_id": "task_backfill_20260805_09_diplomacy_support_sanctions",
  "task_type": "open_web_discovery",
  "role": "open-web-discovery",
  "state": "review",
  "priority": 70,
  "created_at": "2026-08-06T05:02:00Z",
  "parent_issue": 33,
  "issue_number": null,
  "depends_on_task_ids": [],
  "window": {
    "from": "2026-08-05T05:00:00Z",
    "to": "2026-08-06T00:00:00Z"
  },
  "scope": {
    "source_ids": [],
    "source_groups": [],
    "regions": ["ukraine-war"],
    "topics": ["diplomacy", "military-support", "sanctions"],
    "content_types": ["post", "article", "report", "briefing", "document", "image", "video", "map"]
  },
  "exclusions": [
    "Items already represented by canonical URL, platform ID, or content hash",
    "Items already collected for 2026-08-05T00:00:00Z through 2026-08-05T05:00:00Z",
    "Access-control bypass, private material, and unsafe non-public geodata",
    "Precise current operational positions or targeting-enabling detail"
  ],
  "allowed_output_paths": [
    "catalogs/sources/2026/08/05/diplomacy-support-sanctions-backfill-0500-2400.json",
    "data/source-items/2026/08/05/diplomacy-support-sanctions-backfill-0500-2400.ndjson",
    "data/artifacts/2026/08/05/diplomacy-support-sanctions-backfill-0500-2400.ndjson",
    "raw-manifests/2026/08/05/diplomacy-support-sanctions-backfill-0500-2400.json"
  ],
  "definition_of_done": [
    "The assigned public-web discovery shard was searched for the missing 05:00–24:00 UTC interval on 5 August 2026",
    "Primary publications were preferred and upstream lineage was recorded",
    "Canonical URLs, timestamps, language, quote locators, and access failures were recorded",
    "Candidate source profiles and follow-up task proposals were persisted when justified",
    "No item from the already completed 00:00–05:00 UTC interval was duplicated",
    "No final truth assessment, territorial conclusion, or report narrative was added"
  ],
  "idempotency_key": "daily_discovery_gap:2026-08-05:diplomacy-support-sanctions:ukraine-war:20260805T0500Z:20260806T0000Z",
  "lease": {
    "worker_run_id": "run_20260806T064000Z_dipl09",
    "lease_branch": "work/task_backfill_20260805_09_diplomacy_support_sanctions",
    "base_sha": "ace88c03987938f843df5ffcc7ea6de38e979fb4",
    "leased_at": "2026-08-06T06:40:00Z",
    "lease_until": "2026-08-06T08:40:00Z"
  },
  "result": {
    "branch": "work/task_backfill_20260805_09_diplomacy_support_sanctions",
    "pr_number": 124,
    "completed_at": "2026-08-06T06:46:00Z",
    "summary": "Completed a bounded public-web recovery scan of selected Ukrainian, EU, NATO, US, UK, and Canadian official diplomacy, military-support, and sanctions surfaces for the missing 05:00–24:00 UTC interval. No new source item was admitted because the known Reuters EUR 1.4 billion frozen-assets publication is already represented in the international-media shard, while the European Commission primary statement it relays could not be resolved to a distinct stable official URL with verifiable publication time. Other official searches returned out-of-window releases or no qualifying exact-date record. No secondary timestamp was promoted to primary provenance, no artifact was captured, and no policy assessment, claim, observation, or report narrative was created.",
    "coverage_gaps": [
      "The zero-item result is not evidence that no diplomatic, support, or sanctions statement was issued during the interval.",
      "The European Commission statement relayed by Reuters could not be assigned a separate official identity without a stable primary URL and publication time.",
      "The Reuters article is already represented in the international-media shard and was not duplicated as an official-source record.",
      "Official indexes and social-first publication channels may lag or omit exact timestamp metadata.",
      "The scan covered selected Ukrainian, EU, NATO, US, UK, and Canadian official surfaces and is not exhaustive across all governments or languages.",
      "No full text, documents, images, video, webpage bytes, or immutable artifacts were captured.",
      "No diplomatic, sanctions, or support assertion was independently assessed or converted into a claim, observation, policy conclusion, or report narrative."
    ]
  }
}
