{
  "task_id": "task_20260805_05_international_media",
  "task_type": "open_web_discovery",
  "role": "open-web-discovery",
  "state": "merged",
  "priority": 80,
  "created_at": "2026-08-05T05:06:14Z",
  "parent_issue": 33,
  "issue_number": 38,
  "depends_on_task_ids": [],
  "window": {
    "from": "2026-08-04T18:00:00Z",
    "to": "2026-08-05T05:00:00Z"
  },
  "scope": {
    "source_ids": [],
    "source_groups": [],
    "regions": ["ukraine-war"],
    "topics": ["international-media", "operations", "external-support"],
    "content_types": ["post", "article", "report", "briefing", "document", "image", "video", "map"]
  },
  "exclusions": [
    "Items already represented by canonical URL, platform ID, or content hash",
    "Access-control bypass, private material, and unsafe non-public geodata",
    "Precise current operational positions or targeting-enabling detail"
  ],
  "allowed_output_paths": [
    "catalogs/sources/2026/08/05/international-media.json",
    "data/source-items/2026/08/05/international-media.ndjson",
    "data/artifacts/2026/08/05/international-media.ndjson",
    "raw-manifests/2026/08/05/international-media.json"
  ],
  "definition_of_done": [
    "The assigned public-web discovery shard and UTC window were searched",
    "Primary publications were preferred and upstream lineage was recorded",
    "Canonical URLs, timestamps, language, quote locators, and access failures were recorded",
    "Candidate source profiles and follow-up task proposals were persisted when justified",
    "No final truth assessment, territorial conclusion, or report narrative was added"
  ],
  "idempotency_key": "open_web_discovery:international-media:20260804T1800Z:20260805T0500Z:ukraine-war",
  "lease": {
    "worker_run_id": "run_20260805T051110Z_8f3c2a91",
    "lease_branch": "work/task_20260805_05_international_media",
    "base_sha": "38f03b1edb29ee38762460a653474f9d52b6c89b",
    "leased_at": "2026-08-05T05:11:19Z",
    "lease_until": "2026-08-05T07:11:19Z"
  },
  "result": {
    "branch": "work/task_20260805_05_international_media",
    "pr_number": 42,
    "completed_at": "2026-08-05T05:15:29Z",
    "summary": "Registered three international-media items with verified publication timestamps inside the bounded UTC window, explicit Reuters-to-Guardian lineage, excluded-candidate reasoning, access failures and follow-up task proposals; no duplicate source profiles or final truth assessments were added. Self-review found no blocking issues.",
    "coverage_gaps": [
      "Only three items from two outlets had publication timestamps verified inside the narrow eleven-hour UTC window.",
      "The Associated Press candidate was excluded because an exact publication timestamp could not be verified against the task bounds.",
      "BBC candidate pages were not retrievable through the approved connector because of robots/access restrictions.",
      "No image, video, map or immutable webpage artifacts were captured."
    ]
  }
}
