{
  "task_id": "task_daily_20260804_08_visual_osint_maps",
  "task_type": "open_web_discovery",
  "role": "open-web-discovery",
  "state": "ready",
  "priority": 75,
  "created_at": "2026-08-05T10:36:12Z",
  "parent_issue": 55,
  "issue_number": null,
  "depends_on_task_ids": [],
  "window": {
    "from": "2026-08-04T00:00:00Z",
    "to": "2026-08-05T00:00:00Z"
  },
  "scope": {
    "source_ids": [],
    "source_groups": [],
    "regions": ["ukraine-war"],
    "topics": ["visual-osint", "geolocation", "maps"],
    "content_types": ["post", "article", "report", "briefing", "document", "image", "video", "map"]
  },
  "exclusions": [
    "Items already represented by canonical URL, platform ID, or content hash",
    "Access-control bypass, private material, and unsafe non-public geodata",
    "Precise current operational positions or targeting-enabling detail"
  ],
  "allowed_output_paths": [
    "catalogs/sources/2026/08/04/visual-osint-maps.json",
    "data/source-items/2026/08/04/visual-osint-maps.ndjson",
    "data/artifacts/2026/08/04/visual-osint-maps.ndjson",
    "raw-manifests/2026/08/04/visual-osint-maps.json",
    "queue/proposals/task_daily_20260804_08_visual_osint_maps.json",
    "review/self/task_daily_20260804_08_visual_osint_maps.json"
  ],
  "definition_of_done": [
    "The assigned public-web discovery shard and UTC window were searched",
    "Primary publications were preferred and upstream lineage was recorded",
    "Canonical URLs, timestamps, language, quote locators, and access failures were recorded",
    "A queue proposal file was persisted, containing bounded downstream tasks or an explicit empty proposals list",
    "Two separate self-review rounds passed and a receipt was persisted",
    "No final truth assessment, territorial conclusion, or targeting-enabling detail was added"
  ],
  "idempotency_key": "daily_discovery:2026-08-04:visual-osint-maps:ukraine-war",
  "lease": null
}
