{
  "allowed_output_paths": [
    "catalogs/sources/2026/08/04/strikes-infrastructure.json",
    "data/source-items/2026/08/04/strikes-infrastructure.ndjson",
    "data/artifacts/2026/08/04/strikes-infrastructure.ndjson",
    "raw-manifests/2026/08/04/strikes-infrastructure.json"
  ],
  "created_at": "2026-08-04T18:28:29Z",
  "definition_of_done": [
    "The assigned public-web discovery shard and UTC window were searched",
    "Primary publications were preferred and upstream lineage was recorded",
    "Canonical URLs, timestamps, language, quote locators, and access failures were recorded",
    "Candidate source profiles and follow-up task proposals were persisted when justified",
    "No final truth assessment, territorial conclusion, or report narrative was added"
  ],
  "depends_on_task_ids": [],
  "exclusions": [
    "Items already represented by canonical URL, platform ID, or content hash",
    "Access-control bypass, private material, and unsafe non-public geodata",
    "Precise current operational positions or targeting-enabling detail"
  ],
  "idempotency_key": "open_web_discovery:strikes-infrastructure:20260803T1800Z:20260804T1800Z:ukraine-war",
  "issue_number": 19,
  "lease": null,
  "parent_issue": 5,
  "priority": 80,
  "result": {
    "branch": "work/task_20260804_07_strikes_infrastructure",
    "completed_at": "2026-08-05T04:55:26Z",
    "coverage_gaps": [
      "Direct upstream statements from all named regional authorities, companies and ministries were not exhaustively registered.",
      "One Financial Times item was limited to public metadata because full text required a subscription.",
      "No binaries or full-text artifacts were downloaded or hashed.",
      "Discovery records do not verify casualties, damage, military use, targeting intent or attribution."
    ],
    "merge_sha": "f4595132a30e3f78e426b2091f1626beaf090673",
    "merged_at": "2026-08-05T04:55:26Z",
    "pr_number": 22,
    "summary": "Bounded public-web discovery registered three draft source profiles and four source items covering warehouse strikes, port and shipping disruption, and a paywalled parallel report. Attribution and shared upstream lineage were preserved without truth assessment."
  },
  "role": "open-web-discovery",
  "scope": {
    "content_types": [
      "post",
      "article",
      "report",
      "briefing",
      "document",
      "image",
      "video",
      "map"
    ],
    "regions": [
      "ukraine-war"
    ],
    "source_groups": [],
    "source_ids": [],
    "topics": [
      "strikes",
      "air-defense",
      "infrastructure"
    ]
  },
  "state": "merged",
  "task_id": "task_20260804_07_strikes_infrastructure",
  "task_type": "open_web_discovery",
  "window": {
    "from": "2026-08-03T18:00:00Z",
    "to": "2026-08-04T18:00:00Z"
  }
}
