{
  "task_id": "task_backfill_20260804_translate_ru",
  "task_type": "translate_report",
  "role": "translator",
  "state": "pr_open",
  "priority": 55,
  "created_at": "2026-08-05T17:22:00Z",
  "parent_issue": 81,
  "issue_number": null,
  "depends_on_task_ids": [
    "task_backfill_20260804_daily_report_en"
  ],
  "window": {
    "from": "2026-08-04T00:00:00Z",
    "to": "2026-08-05T00:00:00Z"
  },
  "scope": {
    "source_ids": [],
    "source_item_ids": [],
    "source_groups": [],
    "regions": [
      "ukraine-war"
    ],
    "topics": [
      "daily-snapshot",
      "translation",
      "russian"
    ],
    "content_types": [
      "report"
    ]
  },
  "exclusions": [
    "Any factual or analytical change relative to rpt_daily_20260804_en",
    "New web browsing, new evidence, changed claim outcomes, changed confidence, or resolved ambiguity",
    "Translation before the English source task is merged and its exact merge SHA is available"
  ],
  "allowed_output_paths": [
    "data/reports/2026/08/04/daily-ru.json",
    "reports/ru/daily/2026-08-04.md",
    "queue/proposals/task_backfill_20260804_translate_ru.json",
    "review/self/task_backfill_20260804_translate_ru.json"
  ],
  "definition_of_done": [
    "The source report rpt_daily_20260804_en, its exact merged source commit, and claim-set hash were verified before translation",
    "The exact report_id is rpt_daily_20260804_ru, language is ru, and translation_of_report_id is rpt_daily_20260804_en",
    "claim_ids, assessment_ids, claim_set_sha256, dates, links, figures, outcomes, confidence terms, safety qualifiers, and uncertainty were preserved exactly",
    "source_commit equals the English report task merge SHA recorded on main",
    "The Russian manifest and Markdown content were written to the declared paths with record_status approved",
    "A queue proposal receipt was persisted; an empty proposals array is acceptable because the downstream graph is pre-materialized",
    "Two separate self-review rounds passed and a receipt was persisted"
  ],
  "idempotency_key": "backfill_translate:2026-08-04:ukraine-war:ru:v1",
  "lease": {
    "worker_run_id": "run_chatgpt_20260806T035858Z",
    "lease_branch": "work/task_backfill_20260804_translate_ru",
    "base_sha": "3d64aca0fd66a08078bef8074e4c499567ff0ad8",
    "leased_at": "2026-08-06T03:58:58Z",
    "lease_until": "2026-08-06T07:58:58Z"
  },
  "result": {
    "branch": "work/task_backfill_20260804_translate_ru",
    "pr_number": 109
  }
}
