{
  "task_id": "task_auto_bb110619963930f9",
  "task_type": "validation",
  "role": "release-validator",
  "state": "leased",
  "priority": 45,
  "created_at": "2026-08-05T11:06:25.178473Z",
  "parent_issue": 33,
  "issue_number": 75,
  "depends_on_task_ids": [
    "task_20260805_09_diplomacy_support_sanctions"
  ],
  "window": {
    "from": "2026-08-04T18:00:00Z",
    "to": "2026-08-05T05:00:00Z"
  },
  "scope": {
    "source_ids": [],
    "source_groups": [],
    "regions": [
      "ukraine-war"
    ],
    "topics": [
      "diplomacy",
      "military-support",
      "sanctions",
      "index-lag-validation"
    ],
    "content_types": [
      "article",
      "report",
      "briefing",
      "document"
    ]
  },
  "exclusions": [
    "Do not broaden the original UTC window",
    "Do not substitute retrieval, relay, or search-index times for primary publication timestamps",
    "Do not add a truth assessment, source reliability score, operational narrative, or duplicate adjacent-shard item",
    "Do not inspect any source archive other than src_president_of_ukraine, src_mfa_ukraine, src_council_of_the_european_union, src_european_commission, and src_nato"
  ],
  "allowed_output_paths": [
    "raw-manifests/2026/08/05/diplomacy-support-sanctions-validation.json",
    "queue/proposals/task_auto_bb110619963930f9.json",
    "review/self/task_auto_bb110619963930f9.json"
  ],
  "definition_of_done": [
    "Recheck only the primary archives named src_president_of_ukraine, src_mfa_ukraine, src_council_of_the_european_union, src_european_commission, and src_nato after indexing delay without broadening the temporal scope",
    "Record whether any stable canonical publication with a verifiable in-window timestamp now appears",
    "Preserve a zero-item outcome when no qualifying primary publication can be verified",
    "Two separate self-review rounds passed and a receipt was persisted"
  ],
  "idempotency_key": "validation:diplomacy-support-sanctions:index-lag:20260804T1800Z:20260805T0500Z",
  "lease": {
    "worker_run_id": "run_20260805T122530Z_bb110619",
    "lease_branch": "work/task_auto_bb110619963930f9",
    "base_sha": "72aec64e29ca9b0bdd9754f728679f9678ef1d19",
    "leased_at": "2026-08-05T12:25:30Z",
    "lease_until": "2026-08-05T14:25:30Z"
  }
}
